{
  "$schema": "../../docs/stryker.mod.schema.json",
  "id": "facepack-update-vol-223",
  "name": "Facepack Update Vol. 223",
  "version": "223",
  "author": "Communauté FaceMaker",
  "category": "face",
  "compatibility": ["Football Life 2026", "PES 2021", "Sider 7", "LiveCPK"],
  "components": [
    { "type": "livecpk", "root": "livecpk/Facepack_Update_223", "target": "football-life-livecpk-root" }
  ]
}
