{
  "$schema": "../../docs/stryker.mod.schema.json",
  "id": "realism-menu-light-v2",
  "name": "Realism Menu Light Mod",
  "version": "2.0.0",
  "author": "Communauté Football Life",
  "category": "menu",
  "compatibility": ["Football Life 2026", "PES 2021", "Sider 7", "LiveCPK"],
  "components": [
    { "type": "livecpk", "root": "livecpk/Menu Light" }
  ]
}
