{
  "$schema": "../../docs/stryker.mod.schema.json",
  "id": "kitpack-ligue-1-2026-27",
  "name": "Kitpack officiel Ligue 1 2026/27",
  "version": "1.0.0",
  "author": "Prayudi StarGames / communauté Kitmakers",
  "category": "kit",
  "compatibility": ["Football Life 2026", "PES 2021", "Sider 7", "Kitserver"],
  "components": [{ "type": "sider", "root": "content", "target": "content" }]
}
