{
  "$schema": "../../docs/stryker.mod.schema.json",
  "id": "soccer-revolution-11-gameplay",
  "name": "Soccer Revolution 11 Gameplay — constantes et animations",
  "version": "1.1",
  "author": "elijio876",
  "category": "gameplay",
  "compatibility": [
    "Football Life 2026",
    "PES 2021",
    "Sider 7"
  ],
  "sourceUrl": "https://pes-files.com/pes-2021-gameplay-soccer-revolution-2026-update-v11/",
  "components": [
    {
      "type": "livecpk",
      "root": "livecpk/SoccerRevolution11"
    }
  ]
}
