{
  "$schema": "../../docs/stryker.mod.schema.json",
  "id": "mega-facepack-v2-fl26-sider",
  "name": "Mega Facepack V2 — FL26 Sider",
  "version": "2.0.0",
  "author": "Communauté FaceMaker",
  "category": "face",
  "compatibility": [
    "Football Life 2026",
    "PES 2021",
    "Sider 7"
  ],
  "components": [
    {
      "type": "livecpk",
      "root": "livecpk/MEGA_FACEPACK_V2"
    }
  ]
}
